,제목,저자,출판사,출판일,가격,ISBN
69,JavaScript & jQuery(자바스크립트&제이쿼리),김영천^안일영^임정목,기한재,20150310,16200,9788970187556
70,타이타늄 모바일 앱 프로그래밍 (자바스크립트를 이용한 빠른 네이티브 애플리케이션 개발),보이들리 폴렌타인,에이콘출판,20120928,27000,9788960773479
71,개발자와 디자이너가 함께 보는 자바스크립트 프로그래밍,팀 라이트,에이콘출판,20150527,27000,9788960777101
72,"10대를 위한 첫 코딩 (HTML, CSS, 자바스크립트로 홈페이지, 앱, 게임 만들기)",Young Rewired State,반니,20161030,15120,9791185435916
73,DBD 공격과 자바스크립트 난독화로 배우는 해킹의 기술,최우석,한빛미디어,20161020,15120,9788968488344
74,비기닝 폰갭 (자바스크립트와 HTML5를 이용한 모바일 웹 프레임워크),Rohit Ghatol,프리렉,20120425,25200,9788965400202
75,WebGL 3D 프로그래밍 (HTML5와 자바스크립트 웹지엘로 만드는 웹 3D 그래픽),디에고 캔토,에이콘출판,20121113,28500,9788960773622
76,JavaScript Web Applications (모던 자바스크립트 애플리케이션 개발에 필요한 모든 이야기),알렉스 맥카우,한빛미디어,20120601,0,9788979149258
77,깡샘의 코틀린 프로그래밍 (코틀린 기초부터 안드로이드/ 자바스크립트/ 스프링에 응용까지),강성윤,루비페이퍼,20180305,30600,9791186710272
78,자바스크립트+jQuery 완전정복 스터디 3: 중급 고급 활용편 (웹 프론트엔드 개발자를 위한 필독서),김춘경,위키북스,20151016,28800,9791158390143
79,타입스크립트 퀵스타트 (차세대 자바스크립트로 시작하는 대규모 웹 애플리케이션 개발),정진욱,루비페이퍼,20180416,28800,9791186710302
80,JavaScript Patterns(자바스크립트패턴),스토얀 스테파노프,인사이트,20111103,19800,9788966260157
81,타입스크립트 디자인 패턴 (차세대 자바스크립트 표준으로 배우는 핵심 소프트웨어 아키텍처),빌릭 베인,에이콘출판,20170426,22500,9788960779914
82,자바스크립트+jQuery 완전정복 스터디 2: jQuery편 (웹 프론트엔드 개발자를 위한 필독서),김춘경,위키북스,20151016,0,9791158390136
83,오픈 API를 활용한 매쉬업 가이드 (HTML과 자바스크립트로 손쉽게 만드는 AIR 애플리케이션),오창훈,에이콘출판,20090820,29700,9788960770942
84,웹프로그래밍 HTML5 CSS3 자바스크립트 JQuery (with 한국.net 이름포털 사례기반),김영복,21세기사,20170901,23400,9788984688070
85,Dynamic JavaScript(다이나믹 자바스크립트),장계섭,북스홀릭,20110831,0,9788994914374
86,속 깊은 jQuery (완벽한 자바스크립트 이해를 바탕으로 펼치는 속 깊은 제이쿼리 3.X),원형섭,루비페이퍼,20160901,0,9791186710081
87,안드로이드 웹앱 (with HTML CSS 자바스크립트 제이쿼리 제이큐터치 폰갭),조나단 스타크,한빛미디어,20120305,0,9788979149111
88,코딩 교육을 위한 마이크로비트 (자바스크립트 블록 편집기 버전 | 재밌는 예제 중심의 마이크로비트 입문서),아이씨뱅큐,제이펍,20180917,15300,9791188621392
89,머신러닝 TensorFlow.js JavaScript (자바스크립트와 TensorFlow.js 환경에서 머신러닝 구현),김영보,생각나눔,20190415,28800,9791196672430
90,"애프터스킬 반응형 웹 실전 프로젝트 가이드 (HTML5, CSS3, 자바스크립트, 제이쿼리를 한 권으로!!, 최신개정판)",김광수^조혜경,아이콕스(iCox),20190112,27000,9791186886908
91,러닝 웹 디자인 (시작하는 사람을 위한 HTML CSS 자바스크립트 웹 그래픽 가이드),제니퍼 로빈슨,프리렉,20151205,38000,9788965401100
92,모바일 웹 개발의 정석 (HTML5 CSS3 자바스크립트를 이용한 모바일 웹 애플리케이션),그렉 아볼라,제우미디어,20131111,19800,9788959522927
93,"Learning PHP MySQL  JavaScript(한국어판) (소셜 웹 개발자를 위한 3대 핵심 기술 PHP, MySQL, 자바스크립트)",로빈 닉슨,에이콘출판,20110817,0,9788960772199
94,Head First JavaScript Programming (게임과 퍼즐로 배우는 자바스크립트입문서 | 대화형 웹애플리케이션의 시작),에릭 프리먼^엘리자베스 롭슨,한빛미디어,20150201,0,9788968481567
95,"JavaScript jQuery 입문 (개정판, 자바스크립트에서 제이쿼리, 제이쿼리 모바일까지 한 권으로 끝낸다)",윤인성,한빛미디어,20130910,0,9788968480423
96,"Node.js 마이크로서비스 개발 (자바스크립트를 이용한 마이크로서비스 구축부터 보안, 테스트, 배포까지)",디오고 헤센데,위키북스,20190103,22500,9791158391294
97,쉽고 자세한 Eclipse 사용법 (자바 안드로이드 자바스크립트 HTML JSP PHP 폰갭 웹앱을 위한),이두진,PCBOOK,20150820,18000,9788981931407
98,BBC micro:bit 프로그래밍 with 자바스크립트 블록 에디터,서영진,제이펍,20170925,25200,9791185890951
99,콕샘의 웹디자인 배우기 자바스크립트 동영상 강좌(DVD)(인터넷전용상품),윤영혜,디캠퍼스,20111210,0,9788991399587
0,서블릿 JSP 웹 프로그래밍 with HTML CSS XML 자바스크립트 (명강의가 일으키는 감동),김승현,프리렉,20120516,28800,9788965400219
1,에지 애니메이트 CC 무작정따라하기 (HTML5 CSS3 자바스크립트를 몰라도 만들 수 있는 웹 표준 애니메이션),박춘호,길벗,20130927,21600,9788966186099
2,"하이브리드 앱을 구현하는 기술 (HTML5, 자바스크립트, 코도바(폰갭)로 만드는 안드로이드와 iOS 앱 개발)",구보타 미츠노리,한빛미디어,20150301,0,9788968481680
3,읽기 좋은 자바스크립트 코딩 기법 Maintainable JavaScript (유지보수가 쉬운 코드로 팀의 생산성을 높이자),니콜라스 자카스,한빛미디어,20130107,17100,9788979149883
4,Lets 실전 예제로 배우는 자바스크립트+제이쿼리(JavaScript+jQuery) (웹 퍼블리셔를 위한 최고의 기본서),이은정,아이비김영,20201110,19800,9788965121275
5,웹앱 하이브리드 앱 프로그래밍 (67개 예제만 따라하면 HTML5 CSS3 자바스크립트 jQuery Mobile 폰갭 완전정),정동근,앤써북,20130120,12350,9788996873952
6,모바일 웹 (HTML·CSS·자바스크립트에서 캔버스게임·NODEJS·ANGULARJS까지),김병호,도서출판 홍릉(홍릉과학출판사),20180730,18050,9791156005995
7,JavaScript JQuery+JQueryMolile(자바스크립트 제이쿼리+제이쿼리모바일) (반응형 웹&모바일 웹 개발을 위한 입문서),조영철,예문사,20140801,25200,9788927410423
